product_id,title,authors,original_price,current_price,quantity,category,n_review,avg_rating,pages,manufacturer,cover_link
3656561,Animorphs - Người Hóa Thú - Tập 3: Cuộc Đối Đầu,Katherine Applegate,63000,25200,565.0,Truyện dài,20,5.0,172.0,,https://salt.tikicdn.com/ts/product/4f/52/f1/d48d8eb2120e230a05e8257a47715f5a.jpg
205423656,Nhân Duyên Tiền Kiếp,,195000,195000,,Nhân Duyên Tiền Kiếp,0,0.0,,Nhà Xuất Bản Thanh Niên,https://salt.tikicdn.com/ts/product/12/12/90/21d482d8a69ed6e77d2ab3b232ca7159.jpg
16422526,365 Chuyện Kể Trước Giờ Đi Ngủ - Những Câu Chuyện Phát Triển Chỉ Số Tình Cảm EQ (Tái Bản),.,78000,57000,1219.0,Truyện kể cho bé,185,4.7,,,https://salt.tikicdn.com/ts/product/78/17/a6/5d2092167c688437c0e8dfe6b5c2e0de.jpg
109310241,7 Chiến Lược Thịnh Vượng Và Hạnh Phúc (Tái Bản),Jim Rohn,85000,59500,384.0,Sách kỹ năng làm việc,37,5.0,216.0,Nhà Xuất Bản Thế Giới,https://salt.tikicdn.com/ts/product/f7/5b/4d/0118a524e4009423e60d399b028ab171.jpg
205799432,Refresh! 20 Ngày Làm Mới Bản Thân,,199000,159200,,Sách tư duy - Kỹ năng sống,0,0.0,,Nhà Xuất Bản Thế Giới,https://salt.tikicdn.com/ts/product/cf/95/66/2188ab87ab49707dde9e1bc892e238f6.jpg
1476937,Dám Bị Ghét,Koga Fumitake,96000,57600,45858.0,Tiểu Thuyết,3457,4.8,336.0,,https://salt.tikicdn.com/ts/product/74/11/ff/6304c47fec56e6f0b2110be65af0c7c2.jpg
202450668,Cuộc Chiến Tỏ Tình Tập 4 [Tặng Kèm 1 Trong 2 Mẫu Thẻ Học Sinh],Aka Akasaka,40000,37000,178.0,Cuộc Chiến Tỏ Tình Tập 4 [Tặng Kèm 1 Trong 2 Mẫu Thẻ Học Sinh],21,4.8,208.0,Nhà Xuất Bản Kim Đồng,https://salt.tikicdn.com/ts/product/ec/13/a7/f08ca31f5af80a159f4e2ba79bdf6a03.jpg
201712780,LOVED - Marketing cho sản phẩm công nghệ - Định hình cách thế giới nghĩ về bạn,Martina Lauchengco,285000,256500,,Sách Marketing - Bán hàng ,0,0.0,372.0,Nhà Xuất Bản Dân Trí,https://salt.tikicdn.com/ts/product/e5/92/59/e6c23ace7f9e22164dd4bb7748f83068.jpg
53243293,"Green Smoothies - Giảm Cân, Làm Đẹp Da, Tăng Cường Sức Đề Kháng Với 7 Ngày Uống Sinh Tố Xanh",,159000,123000,5166.0,Sách Làm Đẹp,614,4.8,168.0,Nhà Xuất Bản Thế Giới,https://salt.tikicdn.com/ts/product/1f/15/19/0ae02b850d2ac23a80897cac699417de.jpg
76531748,Sách DevUP,,149000,149000,1178.0,Sách tư duy - Kỹ năng sống,277,4.8,204.0,Nhà Xuất Bản Thế Giới,https://salt.tikicdn.com/ts/product/ca/de/a9/f8566b89be89a63f8655eac76de76e9a.jpg
194960744,Đừng bao giờ đi ăn một mình,Keith Ferrazzi,145000,107000,111.0,Sách Marketing - Bán hàng ,7,5.0,,NXB Trẻ,https://salt.tikicdn.com/ts/product/fe/dc/0d/bda7fab4d636e85557ccc8841f36cd40.jpg
207494286,666 Satan Tập 4 [Tặng Kèm Bookmark Nhân Vật],Seishi Kishimoto,30000,30000,20.0,666 Satan Tập 4 [Tặng Kèm Bookmark Nhân Vật],2,5.0,192.0,Nhà Xuất Bản Kim Đồng,https://salt.tikicdn.com/ts/product/fa/83/e5/fb26597d567aa82503f1f8e4396eaebd.jpg
198198501,Ngang Tàng - Tập 2,Vu Triết,198000,124900,137.0,Truyện dài,27,5.0,488.0,Nhà Xuất Bản Hội Nhà Văn,https://salt.tikicdn.com/ts/product/03/29/e9/fea3565b552be581c13655baad3b1c6a.jpg
74362508,Thần Số Học Ứng Dụng,Joy Woodward,129000,70950,8164.0,Sách Chiêm Tinh - Horoscope,1477,4.8,280.0,Nhà Xuất Bản Thanh Niên,https://salt.tikicdn.com/ts/product/81/47/55/75dec2ab26549c43e2a08bcbfdf8c295.jpg
126742911,"Món Quà Của Linh Hồn - 
Sức Mạnh Chữa Lành Của Những Thữ Thách Trong Cuộc Sống",Robert Schwartz,289000,202300,711.0,Sách tư duy - Kỹ năng sống,115,5.0,728.0,Nhà Xuất Bản Hà Nội,https://salt.tikicdn.com/ts/product/51/a9/55/7b9e5c4ea5e63d7fc65e371fd86dbcc8.jpg
162832796,Rilla Dưới Mái Nhà Bên Ánh Lửa,Lucy Maud Montgomery,200000,120000,534.0,Tác phẩm kinh điển,99,5.0,520.0,Nhà Xuất Bản Hội Nhà Văn,https://salt.tikicdn.com/ts/product/46/d4/c5/256f0bce9c7242e3f763240fda75bf07.jpg
121185870,Và Rồi Núi Vọng,Khaled Hosseini,148000,88800,1089.0,Tiểu Thuyết,224,5.0,512.0,Nhà Xuất Bản Hội Nhà Văn,https://salt.tikicdn.com/ts/product/df/36/d9/b067ce3b894d2d1c3192ea78682f690b.jpg
197657911,Tiếng Núi,Kawabata Yasunari,220000,132000,854.0,Tác phẩm kinh điển,79,4.8,384.0,Nhà Xuất Bản Hà Nội,https://salt.tikicdn.com/ts/product/06/b0/b9/7ab33a63c472dddb0310a528119118b9.jpg
116397449,Người Tình Sputnik,Haruki Murakami,86000,51600,1057.0,Tiểu Thuyết,208,5.0,283.0,Nhà Xuất Bản Hội Nhà Văn,https://salt.tikicdn.com/ts/product/a8/24/dc/a64af347987a72011097fd4aa72839e7.jpg
111285054,Quẳng Gánh Lo Đi & Vui Sống (Tái Bản),Dale Carnegie,86000,56700,1565.0,Sách nghệ thuật sống đẹp,187,5.0,312.0,Nhà Xuất Bản Tổng hợp TP.HCM,https://salt.tikicdn.com/media/catalog/producttmp/d0/c2/04/af1acf9c243b19d989186488af670b0d.jpg
148937391,Bóng đêm ký ức - trọn bộ 2 tập - Điều tra phá án - Tặng Bookmark mặt trăng độc quyền,Giảo Giảo,330000,154000,314.0,Tiểu Thuyết,61,5.0,1048.0,NXB Dân Trí,https://salt.tikicdn.com/ts/product/18/b6/b2/90ea348c3345a96e1d9e5545a4446c84.png
129381092,Tư Duy Lại Lợi Thế Cạnh Tranh - 6 Quy Tắc Mới Cho Thời Đại Số,Ram Charan,110000,89100,171.0,"Sách quản trị, lãnh đạo",22,5.0,256.0,NXB Trẻ,https://salt.tikicdn.com/ts/product/1d/6f/65/d9daa43fda26e944a52fcd1e58ce3676.jpg
96357336,Cáo Pax,Sara Pennypacker,116000,69600,1589.0,Tiểu Thuyết,303,5.0,272.0,Nhà Xuất Bản Hội Nhà Văn,https://salt.tikicdn.com/ts/product/5b/36/d2/98867ec1bf4432c70d138985d17df349.jpg
131843989,Bên Kia Đường Có Đứa Dở Hơi (Tái Bản),Wendelin Van Draanen,79000,53000,336.0,Tiểu Thuyết,44,5.0,292.0,Nhà Xuất Bản Phụ Nữ Việt Nam,https://salt.tikicdn.com/ts/product/78/43/16/dc78068c1a4c4d3019cfcad6d34840ba.jpg
1534613,Giáo Trình Chuẩn HSK 5 Bài Học (Tập 1),Khương Lệ Bình,278000,183600,2117.0,Sách Học Tiếng Hoa,278,4.8,196.0,Nhà Xuất Bản Tổng hợp TP.HCM,https://salt.tikicdn.com/ts/product/5f/74/6f/9d36047259f6258f3e997e67848f5f6e.jpg
153521878,Nhân Loại - Một Lịch Sự Tràn Đầy Hi Vọng,Rutger Bregman,245000,176000,429.0,Kiến Thức Bách Khoa,52,4.8,482.0,Nhà Xuất Bản Mỹ Thuật,https://salt.tikicdn.com/ts/product/5e/2e/10/361ceb5a58a4d04a16e9fc4bb6d5947c.jpg
121635152,Không Ai Có Thể Làm Bạn Tổn Thương Trừ Khi Bạn Cho Phép (Tặng Kèm 1 Bộ Bookmark Gồm 4 Cái),Yoo Eun Jung,119000,72800,7994.0,Sách tư duy - Kỹ năng sống,1418,5.0,304.0,Nhà Xuất Bản Dân Trí,https://salt.tikicdn.com/ts/product/48/cf/b6/591dc6b51337aca15183552706b57087.jpg
194104631,Mong Bạn Đừng Khóc Một Mình,Ahn Sang Hyun,88000,67100,208.0,Sách nghệ thuật sống đẹp,18,4.8,192.0,Nhà Xuất Bản Dân Trí,https://salt.tikicdn.com/ts/product/a6/92/1c/3a5b15efcceb756c988ab0789c5d0af5.jpg
176550321,Bàn Về Ham Muốn: Tại Sao Chúng Ta Muốn Thứ Mà Ta Muốn,William B. Irvine,169000,118000,1223.0,Sách nghệ thuật sống đẹp,125,4.8,372.0,Nhà Xuất Bản Công Thương,https://salt.tikicdn.com/ts/product/ec/0d/db/881ef8e65256f339b31a35ae03c5de75.jpg
193684715,Ngoan Cường Vượt Định Kiến,Chimamanda Ngozi Adichie,79000,56900,175.0,Sách Tâm Lý Tuổi Teen,17,4.6,112.0,Nhà Xuất Bản Thanh Niên,https://salt.tikicdn.com/ts/product/58/bf/45/a3b406c7313d54bb6190167c40f1545b.jpg
55078233,#Hashtag 01: Drink - Kinh Doanh Đồ Uống Tại Thị Trường Việt Nam (Tái bản 2020),.,200000,140000,1092.0,Sách Marketing - Bán hàng ,153,4.8,140.0,Nhà Xuất Bản Lao Động,https://salt.tikicdn.com/ts/product/45/8b/e6/f31efedec087898f63fb6d84ca165332.jpg
206308045,Yu-Gi-Oh! Gx Tập 3: Vòng Bảng Kết Thúc!! [Tặng Kèm Bookmark PVC],Kazuki Takahashi,30000,29100,74.0,Yu-Gi-Oh! Gx Tập 3: Vòng Bảng Kết Thúc!! [Tặng Kèm Bookmark PVC],6,4.8,192.0,Nhà Xuất Bản Kim Đồng,https://salt.tikicdn.com/ts/product/c9/a6/a7/3c649431f124d0646d38382303f72790.jpg
117681065,Sống Thực Tế Giữa Đời Thực Dụng (Tái Bản),Mễ Mông,129000,97000,2087.0,Sách tư duy - Kỹ năng sống,441,4.8,360.0,Nhà Xuất Bản Thanh Niên,https://salt.tikicdn.com/ts/product/63/0e/68/ee6afa97336e0d8aa3beb3777db80c4c.jpg
205942262,Kinh Khủng Gì - Đâu,Julia Dohaldson,65000,39000,21.0,Truyện tranh thiếu nhi,0,0.0,26.0,Nhà Xuất Bản Hội Nhà Văn,https://salt.tikicdn.com/ts/product/5a/c7/ff/cee4cfd599a1c8e24ff2292429d20ad2.jpg
11841468,Đừng Bán Bảo Hiểm Hãy Trao Giải Pháp,Pilot Nguyễn,120000,97100,3763.0,Sách kỹ năng làm việc,184,4.7,248.0,Nhà Xuất Bản Tổng hợp TP.HCM,https://salt.tikicdn.com/ts/product/8f/69/ac/1b8bf3e9ba8f1d71577c9b6916c1ca72.jpg
480216,Quấn Quít,Émile Ajar,54000,27000,575.0,Tiểu Thuyết,9,5.0,,,https://salt.tikicdn.com/media/catalog/product/d/e/demo3-quanquit.jpg
3608625,Payback Time - Ngày Đòi Nợ,Phil Town,299000,299000,31234.0,Bài học kinh doanh,4311,4.8,280.0,Nhà Xuất Bản Thế Giới,https://salt.tikicdn.com/ts/product/64/cd/ba/c12f6fca49de9767c6c167c0030f7985.png
77448426,Món Lạ Miền Nam (Tái Bản),Vũ Bằng,58000,34800,337.0,Truyện ngắn - Tản văn - Tạp Văn,60,4.8,353.0,Nhà Xuất Bản Hội Nhà Văn,https://salt.tikicdn.com/ts/product/cf/ae/37/d0b918f37f7fe88d01e2d76c444529ae.jpg
186578993,Đu Đưa Trên Ngọn Cây Bàng,Nguyễn Hoàng Diệu Thủy,118000,70800,169.0,Truyện dài,13,5.0,248.0,Nhà Xuất Bản Phụ Nữ,https://salt.tikicdn.com/ts/product/db/ca/bd/6faafc33dbaf22bf7d21b4dd39f09c16.jpg
205986080,3x3 Eyes - Cô Bé Ba Mắt - Tập 02,Yuzo Takada,90000,78300,136.0,3x3 Eyes - Cô Bé Ba Mắt - Tập 02,11,4.8,394.0,NXB Trẻ,https://salt.tikicdn.com/ts/product/ca/f7/b4/fe886ba2543d18f6bf14947216284cce.jpg
50723822,Con Đường Đi Đến Thành Công Bằng Sự Tử Tế (Tái Bản 2020),Inamori Kazuo,70000,50800,3866.0,Sách tư duy - Kỹ năng sống,253,4.8,204.0,NXB Trẻ,https://salt.tikicdn.com/ts/product/3d/9a/cf/c877639553c09297cafeb8d4a67ff1bd.jpg
201892202,Anh Em Phi Hành Gia - Tập 36,Chuya Koyama,45000,36000,149.0,Anh Em Phi Hành Gia - Tập 36,12,5.0,,NXB Trẻ,https://salt.tikicdn.com/ts/product/99/ee/e3/ef17a669e205cb28c22d137f30bd17f3.jpg
147920905,Đường Mây Qua Xứ Tuyết (Tái Bản),Lama Anagarika Govinda,118000,77800,547.0,Sách Địa Danh - Du Lịch,81,5.0,320.0,Nhà Xuất Bản Thế Giới,https://salt.tikicdn.com/media/catalog/producttmp/3c/ea/c1/f99f98f27c54ca06417ec962574cf22f.jpg
109998520,Bạn Đỡ Ngu Ngơ Rồi Đấy (Bạn Muốn Chế Ngự Tâm Lý Đám Đông)(Tái Bản),David McRaney,129000,92400,614.0,Sách tư duy - Kỹ năng sống,130,5.0,384.0,Nhà Xuất Bản Thế Giới,https://salt.tikicdn.com/ts/product/6a/6c/3d/0f49c16d66b5a0761cc25e721fa2722a.jpg
83004183,Nhóc Miko! Cô Bé Nhí Nhảnh 34,ONO Eriko,20000,16400,2115.0,Nhóc Miko! Cô Bé Nhí Nhảnh 34,529,5.0,188.0,NXB Trẻ,https://salt.tikicdn.com/ts/product/ab/9e/b1/b2921bbcf828873ddf1d6b09600ff5b8.jpg
87978940,Hashtag No.4 Food - Khởi Sự Kinh Doanh Dịch Vụ Ăn Uống (2 Cuốn),,325000,227500,614.0,Sách khởi nghiệp,130,5.0,448.0,Nhà Xuất Bản Dân Trí,https://salt.tikicdn.com/ts/product/09/d2/e5/7b42ec32caf9e0847f74806c1e63b4f1.jpg
207256575,Định luật Murphy – Mọi bí mật tâm lý thao túng cuộc đời bạn,Từ Thính Phong,119000,92400,8.0,Lĩnh vực khác,0,0.0,280.0,Nhà Xuất Bản Thế Giới,https://salt.tikicdn.com/ts/product/11/b9/cd/6908d07d93737fd12fd452f05e174a17.jpg
145511903,Combo 2 cuốn: Giận (Tái Bản 2021) + Không Diệt Không Sinh Đừng Sợ Hãi ( Phát Triển Khả Năng Sống Thực Thị/ Tặng kèm Bookmark),,230500,230500,52.0,Sách nghệ thuật sống đẹp,7,5.0,,Nhiều Nhà Xuất Bản,https://salt.tikicdn.com/ts/product/98/06/c0/d88d1421168f67c122f70062246e27db.jpg
8704163,Thống Kê Trong Kinh Tế Và Kinh Doanh - Statistics For Business And Economics,David R. Anderson,440000,418000,1231.0,"Sách tài chính, kế toán",181,4.8,889.0,Nhà Xuất Bản Kinh Tế TPHCM,https://salt.tikicdn.com/ts/product/4f/07/f5/846e03fdabc7ebd857ef35d1b4208bd6.jpg
103284675,Buồng Tắm,Jean,80000,44000,391.0,Tiểu Thuyết,65,4.8,104.0,Nhà Xuất Bản Hội Nhà Văn,https://salt.tikicdn.com/ts/product/2b/d0/7f/a7256910470b6490762277c5cd2022a3.jpg
192697068,Sách Bước Ra Thế Giới: Cẩm Nang Du Học Và Săn Học Bổng,Nhóm tác giả Spiderum,299000,280000,236.0,Sách tư duy - Kỹ năng sống,19,4.8,492.0,Nhà Xuất Bản Thế Giới,https://salt.tikicdn.com/ts/product/6f/2c/09/c1885a8bc8abaa60e777ca67705e1b61.png
107802188,Bí Mật Tư Duy Triệu Phú (Tái Bản),T.Harv Eker,108000,71200,1701.0,Sách tư duy - Kỹ năng sống,273,5.0,292.0,Nhà Xuất Bản Phụ Nữ Việt Nam,https://salt.tikicdn.com/media/catalog/producttmp/b8/2b/e5/ca368aed46fedca418808238021155fb.jpg
181699664,Những Ngã Tư Và Những Cột Đèn,Trần Dần,200000,160000,567.0,Truyện ngắn - Tản văn - Tạp Văn,87,5.0,650.0,Nhà Xuất Bản Hội Nhà Văn,https://salt.tikicdn.com/ts/product/c5/17/2a/c89f2dc751b1e1964206ba33466bdf98.jpg
196831943,"Lịch Sử Văn Minh Thế Giới Phần IV “Thời Đại Đức Tin”, Tập 2: Văn Minh Hồi Giáo Và Do Thái",Will Durant,275000,156400,148.0,Lịch Sử Thế Giới,18,4.8,628.0,Nhà Xuất Bản Khoa Học Xã Hội,https://salt.tikicdn.com/ts/product/6b/f3/10/2d834a069d9dbe3554b1eeedea5f5437.jpg
1404169,Thư Gửi Từ Miến Điện,Aung San Suu Kyi,92000,73600,4.0,Tiểu Thuyết,1,5.0,248.0,,https://salt.tikicdn.com/ts/product/10/6e/d3/b999083f9c93fe0793a56e3ce47bc6a5.jpg
138934624,Tô Màu Phát Triển Trí Não Bộ Cho Bé 1-3 Tuổi - Tập 1,,16000,9600,193.0,Tô màu - Luyện chữ  ,21,5.0,10.0,Nhà Xuất Bản Dân Trí,https://salt.tikicdn.com/ts/product/e7/de/ae/5cc2f7735d14269276d1331061f0bf0c.jpg
27582931,How Money Works - Hiểu Hết Về Tiền,Dịch giả Bùi Thị Quỳnh Chi,300000,180000,8546.0,Bài học kinh doanh,1291,4.7,257.0,,https://salt.tikicdn.com/ts/product/d9/00/9e/9ba4a6dbd6700f9c6abd30f1a65b93c4.jpg
184070221,OSHO - Hiểu - Đường Đến Tự Do,Osho,168000,110800,911.0,Sách nghệ thuật sống đẹp,121,5.0,368.0,Nhà Xuất Bản Dân Trí,https://salt.tikicdn.com/media/catalog/producttmp/38/2b/7c/3f7d16217d15b7b0030c9577b8c2cec8.jpg
38265901,Điều Quan Trọng Nhất – The Most Important Thing,Howard Marks,299000,299000,4356.0,"Sách tài chính, tiền tệ",568,4.7,378.0,Nhà Xuất Bản Thế Giới,https://salt.tikicdn.com/ts/product/b3/98/f3/97711a7a7a0efc3e6d3ecfae4a43655f.jpg
1674007,Trước Khi Nhắm Mắt,Keigo Higashino,108000,71000,3728.0,Truyện trinh thám,281,4.6,396.0,,https://salt.tikicdn.com/ts/product/aa/df/9e/c017e7d9fdb2d2c91b665724fd3e686a.jpg
95039245,Sách Tư Duy Tâm Lý Hay Nhất - Thuật đọc tâm,,239000,160130,37.0,Sách tư duy - Kỹ năng sống,3,5.0,548.0,Nhà Xuất Bản Thanh Niên,https://salt.tikicdn.com/ts/product/d6/d3/bc/aab8bb20090149d8cad6dfb0b761eff2.jpg
54053152,"Kiếm Tiền Thời Khủng Hoảng - Thoát Khỏi Các Trò Lừa Đảo Khi Thị Trường Chứng Khoán, Bất Động Sản Và Tài Chính Suy Thoái (Tái Bản 2020)",,169000,105400,821.0,Bài học kinh doanh,106,4.8,392.0,Nhà Xuất Bản Công Thương,https://salt.tikicdn.com/ts/product/a6/0f/44/d1ad02681fd85703ab74695c389360de.jpg
199614166,Trái Cây Đại Chiến Zombie - Thế Giới Khủng Long: Tập 3: Trận Chiến Xuyên Thời Gian,Tiếu Giang Nam,89000,66400,22.0,Truyện tranh thiếu nhi,0,0.0,174.0,Nhà Xuất Bản Phụ Nữ Việt Nam,https://salt.tikicdn.com/ts/product/a7/60/95/96d13a895c4d6fdd7d8c77c0ce6d1010.jpg
143172597,2000 English Collocation and Idioms,Trang Anh,200000,104000,1872.0,Sách Học Tiếng Anh,490,4.8,,Nhà Xuất Bản Hồng Đức,https://salt.tikicdn.com/ts/product/e4/a7/2f/0b62e23ebea5d5d1a5e3409481e6bd69.png
198198467,Mình Ngồi Xuống Kể Tổn Thương Trong Lòng,Minh Dự,99000,55300,267.0,Truyện ngắn - Tản văn - Tạp Văn,22,5.0,128.0,Nhà Xuất Bản Hà Nội,https://salt.tikicdn.com/ts/product/2e/46/e4/004826923a9187a12841d0b32c7eaad8.jpg
67060008,"Phát Triển Trí Tuệ Cảm Xúc - Gấu Ơi, Con Lo Lắng Đến Chừng Nào?",Jayneen Sanders,50000,30000,911.0,Kiến thức - Bách khoa,91,5.0,40.0,Nhà Xuất Bản Dân Trí,https://salt.tikicdn.com/ts/product/23/4d/63/2c2a12ce291bd8c02f3814c66c07d9f8.jpg
201037627,Grimgar - Ảo Ảnh Và Tro Tàn Level.14 - [Parano_Mania],Ao Jyumonji,100000,72200,170.0,Grimgar - Ảo Ảnh Và Tro Tàn Level.14 - [Parano_Mania],19,5.0,,Nhà Xuất Bản Kim Đồng,https://salt.tikicdn.com/ts/product/96/c0/63/eda9798b34e6fc4536acd74cff6dcfad.jpg
24862418,Stephen Hawking: Một Trí Tuệ Không Giới Hạn,BBC,189000,126630,18.0,Tiểu sử - Hồi ký,5,3.8,110.0,Nhà Xuất Bản Tri Thức,https://salt.tikicdn.com/ts/product/8f/a3/d2/d9db0babdad9a47e443ee0e0af82b999.jpg
114228620,Combo Tiếng Hàn Tổng Hợp Sơ Cấp 1 Dành Cho Người Việt Nam Bản In Màu - Học Kèm App,nhieu tac gia,320000,224000,159.0,Sách Học Tiếng Hàn,45,5.0,378.0,Nhà Xuất Bản Đại Học Quốc Gia Hà Nội,https://salt.tikicdn.com/ts/product/fd/46/80/71467d752a66abfbf37ccc4949862bc5.jpg
152561885,Combo Người Thông Minh Giải Quyết Vấn Đề Như Thế Nào + Người Giỏi Không Phải Là Người Làm Tất Cả,,116000,104400,1.0,Sách kỹ năng làm việc,0,0.0,,Nhà Xuất Bản Tổng hợp TP.HCM,https://salt.tikicdn.com/ts/product/9b/83/8c/9d23ea52e90d48ca49d3b76da7e32649.jpg
57870426,Sức Mạnh Của Ngôn Từ (Tặng Kèm 1 Photocard Mintbooks Limited),Shin Dohyeon,96000,58520,13288.0,Sách tư duy - Kỹ năng sống,3124,4.8,212.0,Nhà Xuất Bản Thanh Niên,https://salt.tikicdn.com/ts/product/a7/60/ef/ca49f29ec16d25b87383f369471ab42e.jpg
69644748,Thiền Sư Và Em Bé 5 Tuổi,Thích Nhất Hạnh,120000,80400,3869.0,Thiền Sư Và Em Bé 5 Tuổi,594,5.0,232.0,Nhà Xuất Bản Dân Trí,https://salt.tikicdn.com/ts/product/40/50/4f/c66154af241f021f345fb3c53a70f57d.jpg
204363203,Lớp Học Rùng Rợn - Tập 3,Emi Ishikawa,30000,30000,117.0,Lớp Học Rùng Rợn - Tập 3,7,5.0,,Nhà Xuất Bản Kim Đồng,https://salt.tikicdn.com/ts/product/a6/00/ba/ca19447514d1bdb2c2b0c3dda4084fcb.jpg
198587700,Tạp chí Đẹp T09-10/2022 (số 269),,65000,65000,15.0,Tạp chí Đẹp T09-10/2022 (số 269),0,0.0,158.0,Nhà Xuất Bản Thông Tấn,https://salt.tikicdn.com/ts/product/63/6f/23/1e24fc74523568f682dc07973341e82c.jpg
35283865,Bé Gái Khéo Tay Buộc Dây Giày,,72000,61200,1.0,Văn học thiếu nhi,0,0.0,18.0,,https://salt.tikicdn.com/ts/product/ed/99/71/fd903cebfb5b879ff4c061eae9383fe0.jpg
120219392,Người Thầy (Hồi Ức Của Một Nhà Giáo Mỹ),Frank McCourt,118000,70800,542.0,Tiểu sử - Hồi ký,78,4.8,335.0,Nhà Xuất Bản Hội Nhà Văn,https://salt.tikicdn.com/ts/product/16/25/1c/e6cf9ebf933ce4449b906c1638677f85.jpg
198198483,Giá Như Có Ai Đó Dạy Tôi Trưởng Thành,Bloom,96000,76100,232.0,Sách Tâm Lý Tuổi Teen,18,5.0,216.0,Nhà Xuất Bản Văn Học,https://salt.tikicdn.com/ts/product/56/02/3e/cff1af1ee8c9dc82b0722988699a9fe3.jpg
527316,Mát Mát Lạnh Lạnh,Ngọc Bảo An,55000,43500,278.0,Truyện ngắn - Tản văn - Tạp Văn,13,4.7,126.0,,https://salt.tikicdn.com/media/catalog/product/m/a/mat mat lanh lanh.u547.d20160719.t104506.jpg
169262882,Combo 2 cuốn Giáo Trình Hán Ngữ (Sách học Tiếng Trung dành cho người Việt) Giáo Trình Hán Ngữ Tập 1 + Giáo Trình Hán Ngữ Tập 2 (Phiên bản mới - Học bằng App McBooks),,244000,170500,20.0,Sách Học Tiếng Hoa,1,5.0,,hong duc,https://salt.tikicdn.com/ts/product/18/22/67/b75072921579af860c36307d08487b27.jpg
104741661,Combo 2 Tập : 999 Lá Thư Gửi Cho Chính Mình (Tái Bản),Miêu Công Tử,258000,180001,5669.0,Sách tư duy - Kỹ năng sống,1020,5.0,432.0,Nhà Xuất Bản Thanh Niên,https://salt.tikicdn.com/ts/product/6b/45/d7/9016185f3888b435a77fca4585738d0c.jpg
199739988,Bách Khoa Thư Cho Cả Nhà - Thế Giới Các Loài Hoa Bằng Tranh,Virginie Aladjidi,120000,72000,44.0,Kiến Thức Bách Khoa,5,5.0,60.0,Nhà Xuất Bản Dân Trí,https://salt.tikicdn.com/ts/product/9d/c3/17/45c38bab4731846510625e9e8672fc66.jpg
174605333,Châu Phi Nghìn Trùng (Tái Bản),ISAK DINESEN,165000,130000,555.0,Tiểu sử - Hồi ký,64,5.0,408.0,Nhà Xuất Bản Phụ Nữ,https://salt.tikicdn.com/ts/product/ab/59/99/28fa7031957b3042ca02596ab5d27d7c.jpg
21031780,Pháo Đài Số ( Tái Bản ),Dan Brown,199000,134000,1759.0,Truyện trinh thám,361,4.7,585.0,,https://salt.tikicdn.com/ts/product/b6/1e/a5/81b4a728dc8c73efdb3107392068f802.jpg
199045171,Migi & Dali - Tập 4,Nami Sano,40000,40000,240.0,Migi & Dali - Tập 4,21,5.0,,Nhà Xuất Bản Kim Đồng,https://salt.tikicdn.com/ts/product/51/18/e5/f3fa432792ec220671a4859898de8c41.jpg
51613367,Hạnh Ngộ Trong Bóng Tối,Otsuichi,108000,54000,830.0,Tiểu Thuyết,141,4.7,264.0,Nhà Xuất Bản Hà Nội,https://salt.tikicdn.com/ts/product/ff/a8/46/284894894471be5761eede180c9c5b63.jpg
1864759,Giáo Trình HSK 3 - Sách Bài Tập (Kèm MP3),Khương Lệ Bình,188000,133001,1627.0,Sách Học Tiếng Hoa,218,5.0,168.0,Nhà Xuất Bản Tổng hợp TP.HCM,https://salt.tikicdn.com/ts/product/74/f3/00/9732289d7395efd16f77fd3d08dfcb35.jpg
52805060,Chúa Ruồi - Tiểu Thuyết (Nobel Văn Chương 1983)(Tái Bản 2020),William Golding,88000,52800,3918.0,Tác phẩm kinh điển,744,4.8,326.0,Nhà Xuất Bản Văn Học,https://salt.tikicdn.com/ts/product/5f/97/52/a53eb98af3927cc5b5aeb08efa58d483.jpg
195801674,Khúc Hát Của Chim Ca Và Rắn Độc,Suzanne Collins,236000,159001,171.0,Truyện Giả tưởng - Huyền Bí - Phiêu Lưu,18,5.0,644.0,Nhà Xuất Bản Hội Nhà Văn,https://salt.tikicdn.com/ts/product/56/46/bf/40b59192d57d5ffebb5a2e3c2f7c14bb.jpg
110448020,Nhà Ảo Thuật Đen Và Vụ Án Mạng Tại Thị Trấn Không Tên,Higashino Keigo,199000,119400,2293.0,Truyện trinh thám,524,4.8,440.0,Nhà Xuất Bản Hà Nội,https://salt.tikicdn.com/ts/product/35/a0/e0/01baad28325887ae85e02590f98c4008.jpg
10005245,Đàn Ông Sao Hỏa Đàn Bà Sao Kim,John Gray,188000,135000,48419.0,Sách tư duy - Kỹ năng sống,3904,4.7,488.0,,https://salt.tikicdn.com/ts/product/0a/f6/38/bc10734989977da424642a1c4750eee2.jpg
109515306,Combo 2 Cuốn: Truyện Cổ Grim 1 + 2,Jacob,410000,237800,320.0,Truyện cổ tích,89,4.8,892.0,Nhà Xuất Bản Hà Nội,https://salt.tikicdn.com/ts/product/5a/f7/05/4e323d3d25e37efa44196bd7b60f94a2.jpg
172069382,Einstein Cuộc Đời Và Vũ Trụ,Walter Isaacson,319000,227500,55.0,Sách Danh Nhân,10,4.8,720.0,Nhà Xuất Bản Thế Giới,https://salt.tikicdn.com/ts/product/b2/3d/47/1a87661e132b2bb953ee8412636fe386.jpg
57905707,Chữ Số Và Thế Giới - Nguồn Gốc Bị Lãng Quên,Đỗ Minh Triết,145000,107000,1884.0,Lĩnh vực khác,314,4.8,420.0,Nhà Xuất Bản Hà Nội,https://salt.tikicdn.com/ts/product/14/72/41/38147755c1fe42d4de8d2d4de3227a59.jpg
114447395,Mùa Thu Của Cây Dương,Kazumi Yumoto,62000,37200,462.0,Tiểu Thuyết,105,5.0,204.0,Nhà Xuất Bản Văn Học,https://salt.tikicdn.com/ts/product/7d/4b/29/b252c9f9a64a6853f7408e244075805d.jpg
168662558,CCMR. Phải Trái Đúng Sai,Michael Sandel,155000,97100,591.0,Sách tư duy - Kỹ năng sống,83,5.0,402.0,NXB Trẻ,https://salt.tikicdn.com/ts/product/40/bf/63/980deeb76442bca207341dc948e2022c.jpg
16391543,Cha Voi - Dạy Con Nên Người Ở Thời Đại Số,Trương Nguyện Thành,150000,100500,4480.0,Sách Làm Cha Mẹ,257,5.0,332.0,Nhà Xuất Bản Dân Trí,https://salt.tikicdn.com/ts/product/07/47/8d/d096ad19f102b727476b63dd9300f785.jpg
196517620,Điểm Đến Cuộc Đời,Đặng Hoàng Giang,90000,54000,55.0,Sách tư duy - Kỹ năng sống,5,5.0,236.0,Nhà Xuất Bản Hội Nhà Văn,https://salt.tikicdn.com/ts/product/5b/f0/8f/b672b98a1944a98c87667497d5e18421.jpg
603035,Tiền - Thư Tuyệt Mệnh,Anne Roumanoff,136000,86001,278.0,Tiểu Thuyết,10,4.7,496.0,,https://salt.tikicdn.com/media/catalog/product/t/i/tien-thu-tuyet-menh-01.u5102.d20170405.t180957.361966.jpg
98733259,Những Tù Nhân Của Địa Lí - Khám Phá Sự Vận Hành Của Thế Giới Qua Những Tấm Bản Đồ - Phiên Bản Minh Hoạ Màu Dành Cho Độc Giả Trẻ,Tim Marshall,230000,168000,939.0,Kiến thức - Bách khoa,172,4.8,72.0,Nhà Xuất Bản Kim Đồng,https://salt.tikicdn.com/ts/product/49/b0/e0/de1621358fb64d08a8f5c08e2a0e1130.jpg
148802212,Phong Ma Yến Tước Tập 1 - Nuối Tiếc Giang Hồ,,215000,183000,,Tiểu Thuyết,0,0.0,460.0,Nhà Xuất Bản Hà Nội,https://salt.tikicdn.com/ts/product/16/81/6c/1b98c1c0065dd467f536e9ae1eb466fc.jpg
73515859,OSHO - Can Đảm Là Chính Mình Trong Thế Giới Hiểm Nguy,Osho,88000,58000,1429.0,Sách tư duy - Kỹ năng sống,221,5.0,192.0,Nhà Xuất Bản Thế Giới,https://salt.tikicdn.com/media/catalog/producttmp/2c/10/64/f116603f354b8a543e4d0f7a94d3cbbe.jpg
197588267,Tô Màu Phát Triển Não Bộ Cho Bé 1-5 Tuổi Tập 6,Phạm Ngọc Điệp,16000,9600,77.0,Tô màu - Luyện chữ  ,6,5.0,20.0,Nhà Xuất Bản Dân Trí,https://salt.tikicdn.com/ts/product/36/17/e4/cd5858a422f9849a96a6af59053d3330.jpg
194104633,Ăn Chay Cùng Nhi,Dương Yến Nhi,249000,160800,437.0,Sách Nấu ăn,47,5.0,192.0,Nhà Xuất Bản Phụ Nữ Việt Nam,https://salt.tikicdn.com/ts/product/e3/c1/c5/03fc664a1134098e341b5816ccb4fee1.jpg
