product_id,title,authors,original_price,current_price,quantity,category,n_review,avg_rating,pages,manufacturer,cover_link
55462653,Dọn Giường Đi Rồi Thay Đổi Thế Giới - 10 Bài Học làm Nên Sự Nghiệp Của Một SEAL Vĩ Đại,William H. McRaven,72000,43200,1764.0,Sách tư duy - Kỹ năng sống,229,4.7,128.0,Nhà Xuất Bản Thế Giới,https://salt.tikicdn.com/ts/product/3e/2b/4e/b7202353c9e57f69a83b197edc567e21.jpg
56377199,Giải Mã Siêu Trí Tuệ,Vishen Lakhiani,159000,106530,306.0,Sách tư duy - Kỹ năng sống,28,4.6,356.0,Nhà Xuất Bản Công Thương,https://salt.tikicdn.com/ts/product/1c/89/fc/fa66037ded9ad4aa625046a30aadc4f1.jpeg
198198468,Hay Chúng Mình Đừng Hứa Hẹn Gì Nhau,Minh Dự,115000,64200,272.0,Truyện ngắn - Tản văn - Tạp Văn,21,5.0,152.0,Nhà Xuất Bản Văn Học,https://salt.tikicdn.com/ts/product/1b/db/85/0086b8776facfa3caf4618dcb824de07.jpg
32592661,Vui học Thành Ngữ Tục Ngữ Ca Dao Bằng Tranh,"Mai Hương (Sưu tầm, Biên soạn)",66000,63700,54.0,Truyện kể cho bé,5,5.0,120.0,Nhà Xuất Bản Phụ Nữ,https://salt.tikicdn.com/ts/product/70/ac/b6/840fa3dd254261d7683c58348d093e4e.jpg
167146640,Bạn Đắt Giá Bao Nhiêu? (Tái Bản 2022),Vãn Tình,129000,90001,1152.0,Sách tư duy - Kỹ năng sống,125,4.8,320.0,Nhà Xuất Bản Thế Giới,https://salt.tikicdn.com/ts/product/de/d9/49/082172f16e35f91827ce6d2f8318ad6b.png
187933654,Tạo Dựng Thương Hiệu Cá Nhân (Tái Bản 2022),Yamamoto Hideyuki,109000,65400,160.0,Sách tư duy - Kỹ năng sống,11,5.0,200.0,Nhà Xuất Bản Thế Giới,https://salt.tikicdn.com/ts/product/14/fe/4b/1e9402201321dceab537b8df213b0862.png
66067655,Trải Nghiệm Khách Hàng Xuất Sắc,Nguyễn Dương,250000,167500,8054.0,"Sách quản trị, lãnh đạo",810,5.0,344.0,Nhà Xuất Bản Thế Giới,https://salt.tikicdn.com/ts/product/1c/fb/b8/f924b4eff4598c5fc7b511be448caa95.jpg
73222800,Nghĩ Giàu Và Làm Giàu (Khổ Nhỏ),Napoleon Hill,108000,71200,1535.0,Bài học kinh doanh,277,4.7,416.0,Nhà Xuất Bản Tổng hợp TP.HCM,https://salt.tikicdn.com/media/catalog/producttmp/3d/c6/eb/bcb715674842719103e296f6355c08b3.jpg
200672813,Combo Sách Seneca: Những Bức Thư Đạo Đức Tập 1 + Tập 2,Lucius Annaeus Seneca,308000,308000,1.0,Sách nghệ thuật sống đẹp,0,0.0,894.0,Nhà Xuất Bản Thế Giới,https://salt.tikicdn.com/ts/product/35/94/d9/bb8738a59fda5f8e9fa774fd6a9ab5c3.jpg
100376369,Đứa Con Gái Hoang Đàng - Hai Số Phận - Phần II,Jeffrey Archer,185000,125000,3058.0,Tiểu Thuyết,747,4.6,836.0,Nhà Xuất Bản Lao Động,https://salt.tikicdn.com/ts/product/b2/01/d3/558095f027444a6b9a1e50d483f48e9c.jpg
181379116,Hackers Toeic Vocabulary (Tái Bản),Hackers,279000,179000,223.0,Sách Học Tiếng Anh,40,4.8,556.0,Nhà Xuất Bản Dân Trí,https://salt.tikicdn.com/ts/product/e0/22/b4/338c84322f68aa7b5224288e65b765e6.jpg
69644752,Toàn Thư Chiêm Tinh Học Nhập Môn,Joanna Martine Woolfolk,350000,234500,4057.0,Sách Chiêm Tinh - Horoscope,1037,5.0,508.0,Nhà Xuất Bản Thế Giới,https://salt.tikicdn.com/ts/product/cb/22/67/8fe8931b78c751781e78c09852b00144.jpg
425716,Atlas Giải Phẫu Cơ Thể Người,BS. Alice Roberts,680000,544000,122.0,Atlas Giải Phẫu Cơ Thể Người,16,5.0,512.0,Nhà Xuất Bản Dân Trí,https://salt.tikicdn.com/media/catalog/product/1/_/1._atlas_giai_phau_nguoi.jpg
199176577,Tâm Lý Học Thói Quen – Quan Sát Có Chủ Đích - Tặng Kèm Bookmark 2 Mặt,Chu Kiến Quốc,99000,60400,92.0,Lĩnh vực khác,7,5.0,265.0,Nhà Xuất Bản Thế Giới,https://salt.tikicdn.com/ts/product/76/b8/d5/f889fe22eb3039a39aa01586b722fe98.jpg
94159129,Franken-Stein Ở Baghdad,Ahmed Saadawi,148000,59200,188.0,Tiểu Thuyết,36,4.7,356.0,Nhà Xuất Bản Hội Nhà Văn,https://salt.tikicdn.com/ts/product/d9/8b/7a/77ab2a7bfd0d048965be10f31b2eda12.jpg
190592910,Combo 2 Cuốn Tâm Lý Kẻ Phạm Tội: 8 Vụ Án Hoàn Hảo + Tâm Lý Học Tội Pham,Nhiều tác giả,290000,200000,173.0,Sách tư duy - Kỹ năng sống,35,5.0,,Nhà Xuất Bản Thanh Niên,https://salt.tikicdn.com/ts/product/71/47/2e/8de9348efd590722ece7f8a63b98b158.jpg
480687,Vô Thường,Nguyễn Bảo Trung,79000,52000,10187.0,Truyện ngắn - Tản văn - Tạp Văn,707,4.8,216.0,,https://salt.tikicdn.com/ts/product/51/cf/19/024f4bacf6c38c06fb537dc41cced5ad.jpg
195573526,The Secret - The Magic - Phép Màu (Tái Bản 2022),Rhowa Byrne,198000,198000,259.0,Sách tư duy - Kỹ năng sống,25,5.0,,Nhà Xuất Bản Thế Giới,https://salt.tikicdn.com/ts/product/0f/3a/43/6400662d3982f395738000b457f2a022.jpg
74983590,Trả Giá,Ioka Shun,188000,75200,261.0,Tiểu Thuyết,53,4.7,508.0,Nhà Xuất Bản Hà Nội,https://salt.tikicdn.com/ts/product/5f/0c/14/31828dee450c372adeabeb31849c4fee.jpg
197920813,Những Nhà Tư Tưởng Lớn - Plato Trong 60 Phút,Walther Ziegler,85000,51000,32.0,Sách Danh Nhân,7,4.7,144.0,Nhà Xuất Bản Hồng Đức,https://salt.tikicdn.com/ts/product/e3/61/11/80baa2d34a0f4a30a59592dc9a91ff92.jpg
162201947,One Piece - Tập 98: “Phút Huy Hoàng Của Những Trung Thần”,Eiichiro Oda,25000,25000,1097.0,One Piece - Tập 98: “Phút Huy Hoàng Của Những Trung Thần”,197,5.0,200.0,Nhà Xuất Bản Kim Đồng,https://salt.tikicdn.com/ts/product/e3/00/f0/23758a731d028df38e23202865a90257.jpg
199039798,Mỹ Vị Hầm Ngục - 4,Kui Ryoko,58000,49200,231.0,Mỹ Vị Hầm Ngục - 4,33,5.0,192.0,Nhà Xuất Bản Hồng Đức,https://salt.tikicdn.com/ts/product/0c/7e/b6/c764552b4049046c72d75fbedc169179.jpg
9948023,Của Chuột Và Người,John Steinbeck,86000,51600,1530.0,Truyện dài,225,4.8,149.0,Nhà Xuất Bản Hội Nhà Văn,https://salt.tikicdn.com/ts/product/d0/37/81/e964a484e38e55f48f42a622c4897589.jpg
129766803,Khác Biệt Hay Là Chết (Tái Bản),Jack Trout,128000,84400,536.0,Sách tư duy - Kỹ năng sống,81,5.0,344.0,Nhà Xuất Bản Tổng hợp TP.HCM,https://salt.tikicdn.com/media/catalog/producttmp/fd/44/5b/7febda78b893cb989215401956ca6bd6.jpg
186237324,Thiên quan tứ phúc - Tập 5 (Tiểu thuyết đam mỹ) -  Tặng kèm 1 bookmark 2 mặt,Mặc Hương Đồng Khứu,159000,119000,350.0,Truyện đam mỹ,85,5.0,392.0,Nhà Xuất Bản Hà Nội,https://salt.tikicdn.com/ts/product/ab/fc/43/f7d836dfdc3b2745af30eff0cd7ee92f.jpg
205227772,1111 - Nhật Ký Sáu Vạn Dặm Trên Yên Xe Cà Tàng,,325000,292500,,Sách Địa Danh - Du Lịch,0,0.0,,NXB Trẻ,https://salt.tikicdn.com/ts/product/51/15/ce/b79555620f87a9ab52e8dc698b2a62a0.jpg
85763211,Hãy Khiến Tương Lai Biết Ơn Vì Hiện Tại Bạn Đã Cố Gắng Hết Mình (Tặng Kèm: 01 Bookmark),Bạch Tô,99000,64001,10037.0,Sách tư duy - Kỹ năng sống,2253,5.0,320.0,Nhà Xuất Bản Văn Học,https://salt.tikicdn.com/ts/product/6f/a1/9b/cdb06e4dfe576e20b4517b48e33ee141.jpg
207852953,Blue Period - Tập 07,Yamaguchi Tsubasa,48000,48000,14.0,Blue Period - Tập 07,1,5.0,192.0,NXB Trẻ,https://salt.tikicdn.com/ts/product/b3/69/07/aa645a4554ad29e6084a5c46cef68f86.jpg
200705613,Doraemon Movie Story: Nobita Và Cuộc Đại Thủy Chiến Sở Xứ Sở Người Cá (Tái Bản 2022),Fujiko F Fujio,32000,32000,,Doraemon Movie Story: Nobita Và Cuộc Đại Thủy Chiến Sở Xứ Sở Người Cá (Tái Bản 2022),0,0.0,,Nhà Xuất Bản Kim Đồng,https://salt.tikicdn.com/ts/product/49/07/b7/5f699b355a49b231d1fb62e3452c829d.jpg
205696535,Chiến Tranh Tiền Tệ - Phần 5 - Tương lai của tiền tệ thế giới – Bình yêu trước giông bão - Song Hong Bing,,134500,134500,,"Sách tài chính, tiền tệ",0,0.0,,Nhà Xuất Bản Lao Động,https://salt.tikicdn.com/ts/product/48/26/5b/db43b8a5259a939ffa4ee598c6a636bc.jpg
185071145,Sói Đầu Đàn Và Cún Nhỏ - Tập 2,Ma Vĩ,135000,101000,2418.0,Sói Đầu Đàn Và Cún Nhỏ - Tập 2,903,5.0,192.0,Nhà Xuất Bản Hà Nội,https://salt.tikicdn.com/ts/product/b0/f8/42/52ddead08d074af75ba84245ed20103d.png
178483637,Nước Ép Trị Liệu Và Chế Độ Ăn Theo Phương Pháp Cơ Thể Tự Chữa Lành,Emma Phạm,199000,139300,1792.0,Nước Ép Trị Liệu Và Chế Độ Ăn Theo Phương Pháp Cơ Thể Tự Chữa Lành,219,5.0,340.0,Nhà Xuất Bản Thế Giới,https://salt.tikicdn.com/ts/product/ce/03/a6/03cea0cb853c06293f9e178896b50f6c.jpg
48323805,Sách Người trong muôn nghề,Nhóm tác giả,169000,169000,5160.0,Sách tư duy - Kỹ năng sống,767,4.8,216.0,Nhà Xuất Bản Hồng Đức - Hội Luật Gia Việt Nam,https://salt.tikicdn.com/ts/product/40/85/88/703b8d979028fe282cd4144bd9db9c2c.png
5154645,Ở Quán Cà Phê Của Tuổi Trẻ Lạc Lối (Tái Bản),,59000,35400,2563.0,Truyện ngắn - Tản văn - Tạp Văn,341,4.8,153.0,,https://salt.tikicdn.com/ts/product/f4/95/89/e31e516898b3e30a9ff5abc092e85d5c.jpg
205942269,Cánh Cổng Sát Nhân,Higashino Keigo,249000,187000,294.0,Truyện trinh thám,23,5.0,526.0,Nhà Xuất Bản Hà Nội,https://salt.tikicdn.com/ts/product/8c/78/d5/0e7c343e57e4344e3a60684484cd1651.jpg
73633330,"Think And Grow Rich - 13 Nguyên Tắc Nghĩ Giàu, Làm Giàu (Tái Bản)",Napoleon Hill,110000,77000,12230.0,Sách kỹ năng làm việc,1958,4.8,399.0,Nhà Xuất Bản Lao Động,https://salt.tikicdn.com/ts/product/0b/cd/50/9c219e191737b2757911b962eeb54c2c.jpg
39521136,Để Hiệu Quả Trong Công Việc (Tái Bản 2019),Brian Tracy,52000,34300,2114.0,Sách kỹ năng làm việc,171,4.8,128.0,,https://salt.tikicdn.com/media/catalog/producttmp/bf/dc/bd/c6f48f3d4137f8dbbe832609e630a386.jpg
169825414,"Bộ 5 Cuốn 10 Vạn Câu Hỏi Vì Sao: Vũ Trụ Kỳ Bí, Thế Giới Thực Vật, Thế Giới Động Vật, Cơ Thể Người, Bí Ẩn Quanh Ta",,249000,249000,74.0,Kiến thức - Bách khoa,7,5.0,,Nhà Xuất Bản Hồng Đức,https://salt.tikicdn.com/ts/product/50/80/1d/4a142b7d700d58b42e96ad26ed241906.jpg
17336364,Phía Sau Nghi Can X (Tái Bản 2019),Higashino Keigo,109000,65400,16595.0,Truyện trinh thám,3213,4.8,396.0,,https://salt.tikicdn.com/ts/product/23/56/86/a538698ead7dc2f693d1e9778417317d.jpg
160370177,Không Ai Qua Sông (Tập Truyện Ngắn Nguyễn Ngọc Tư)(Tái Bản),Nguyễn Ngọc Tư,100000,71900,127.0,Truyện ngắn - Tản văn - Tạp Văn,13,4.8,170.0,NXB Trẻ,https://salt.tikicdn.com/ts/product/b3/40/60/d609217f1e2de9968a8ebfda55ea15b3.jpg
201687274,Có Một Nổi Buồn Vừa Ngang Qua Đây,Gã,88000,64900,114.0,Truyện ngắn - Tản văn - Tạp Văn,6,5.0,192000.0,Nhà Xuất Bản Văn Học,https://salt.tikicdn.com/ts/product/08/fd/a5/05dc5551043717fe7f3793a063d29a6d.jpg
196849394,"Gửi Em, Người Bất Tử - Tập 6 (Tái Bản 2022)",Yoshitoki Oima,30000,23900,217.0,"Gửi Em, Người Bất Tử - Tập 6 (Tái Bản 2022)",28,5.0,,NXB Trẻ,https://salt.tikicdn.com/ts/product/24/d4/ab/55dd65855ffc26b9fa37d899aa1ea261.jpg
69624539,Khoa Học Về Yoga,Ann Swanson,300000,180000,1916.0,Lĩnh vực khác,345,4.8,220.0,Nhà Xuất Bản Thế Giới,https://salt.tikicdn.com/ts/product/bc/d1/08/8acdc2a567cf806aad3c998e4dd26993.jpg
201892200,Black Jack Tập 15 (Bìa Cứng),Osamu Tezuka,135000,115000,183.0,Black Jack Tập 15 (Bìa Cứng),13,5.0,,NXB Trẻ,https://salt.tikicdn.com/ts/product/57/49/21/ce16a30e64bf5343ab4c0aca0310bc9b.jpg
109515310,Truyện Cổ Grim 2,Jacob,200000,162000,171.0,Truyện cổ tích,50,4.8,426.0,Nhà Xuất Bản Hà Nội,https://salt.tikicdn.com/ts/product/5a/f7/05/d848ed245bd98f7f104aaec8d969fa25.jpg
186290810,Chú Bé Rắc Rối (Tái Bản 2022),Nguyễn Nhật Ánh,38000,27300,104.0,Truyện ngắn - Tản văn - Tạp Văn,13,5.0,188.0,NXB Trẻ,https://salt.tikicdn.com/ts/product/9a/cf/ee/6f03cc688cfa861fa06481530872cf92.jpg
198415075,Ikigami - Tập 10,Motoro MASE,45000,39100,287.0,Ikigami - Tập 10,25,5.0,,NXB Trẻ,https://salt.tikicdn.com/ts/product/ca/c2/00/aa9668c548f92f586105a367264fb5c6.jpg
187934204,Nghệ Thuật Quản Lý Tài Chính Cá Nhân (Tái Bản 2022),Brian Tracy,159000,114000,52.0,Sách tư duy - Kỹ năng sống,9,5.0,324.0,Nhà Xuất Bản Lao Động,https://salt.tikicdn.com/ts/product/c5/1e/16/8139f4e30b7b7ad628793698c27bad83.png
56878836,Muôn Kiếp Nhân Sinh (Bìa Cứng),Nguyên Phong,228000,150000,7391.0,Muôn Kiếp Nhân Sinh (Bìa Cứng),1421,5.0,424.0,Nhà Xuất Bản Tổng hợp TP.HCM,https://salt.tikicdn.com/media/catalog/producttmp/29/a4/cd/7e452a841c479d7cc191d2e1e55d721c.jpg
3577375,Khả Năng Gặp Được Nửa Hoàn Hảo Của Mình Là Bao Nhiêu?,,95000,95000,1.0,Sách tư duy - Kỹ năng sống,1,5.0,296.0,Nhà Xuất Bản Thế Giới,https://salt.tikicdn.com/ts/product/2a/6e/c9/e59385a7ccb68c087edcc3213d6b8527.jpg
136980493,"Kinh tế học về Tiền, Ngân hàng và Thị trường Tài chính - Ấn bản thứ 12",Frederic S. Mishkin,888000,888000,30.0,"Sách tài chính, tiền tệ",11,5.0,668.0,Nhà Xuất Bản Tài Chính,https://salt.tikicdn.com/ts/product/32/b2/0a/645d69219718f5a68e1024bb7b06f567.jpg
161008715,Power Vs Force - Trường Năng Lượng Và Những Nhân Tố Quyết Định Hành Vi Của Con Người (Tái Bản),David R.Hawkins,179000,125300,2792.0,Kiến Thức Bách Khoa,281,5.0,398.0,Nhà Xuất Bản Thế Giới,https://salt.tikicdn.com/ts/product/37/54/79/b699efce8c0f4029f424019f561ef327.png
170708219,Đừng Bao Giờ Chia Đôi Lợi Ích Trong Mọi Cuộc Đàm Phán,Chris Voss,179000,112770,237.0,Sách tư duy - Kỹ năng sống,19,5.0,420.0,Nhà Xuất Bản Thế Giới,https://salt.tikicdn.com/ts/product/df/0b/69/70ccc4d4c745203fbeb643731298aeb6.jpg
76012191,"Ta Bắt Đầu Cuộc Đời Mới, Khi Nhận Ra Mình Chỉ Sống Một Lần",Raphaëlle Giordano,108000,64800,1354.0,Truyện ngắn - Tản văn - Tạp Văn,209,5.0,292.0,Nhà Xuất Bản Hội Nhà Văn,https://salt.tikicdn.com/ts/product/91/d7/a4/0b66b99912f2daf81b09fdde03a9a722.jpg
201431426,Vua Sáng Chế - Tập 20,Tatsuki Nohda,20000,19100,210.0,Vua Sáng Chế - Tập 20,19,5.0,,Nhà Xuất Bản Kim Đồng,https://salt.tikicdn.com/ts/product/59/47/ca/d2c7692d29f2ee672506057b3fdd46a8.jpg
188695904,GIẬN (TBL22),Thích Nhất Hạnh,135000,116000,1802.0,GIẬN (TBL22),145,5.0,248.0,Nhà Xuất Bản Thế Giới,https://salt.tikicdn.com/ts/product/56/4a/55/ded53bb350d07e82bf01a2b819a0e100.jpg
160082484,Thực Hành Drucker,William A. Cohen,165000,99000,180.0,"Sách quản trị, lãnh đạo",12,4.8,392.0,Nhà Xuất Bản Dân Trí,https://salt.tikicdn.com/ts/product/98/a5/37/632737c8b712802d71a03ab533c8abdd.jpg
205033951,Một chỗ trong đời,Annie Ernaux,69000,51700,240.0,Tác phẩm kinh điển,14,5.0,98.0,Nhà Xuất Bản Hội Nhà Văn,https://salt.tikicdn.com/ts/product/17/ae/b5/0331341f5afd84a1845acd591572d710.jpg
43775511,Tiếng Hàn Tổng Hợp Dành Cho Người Việt Nam - Sơ Cấp 1 (Bản Đen Trắng),.,150000,120000,191.0,Sách Học Tiếng Hàn,57,5.0,378.0,,https://salt.tikicdn.com/ts/product/9c/4d/7e/f8d244f4ac8300935c4702647dfb51ec.jpg
204473050,Kinh Tế Học Vĩ Mô (2022),,288000,288000,36.0,Giáo Trình Đại Học - Cao Đẳng,1,5.0,,hong duc,https://salt.tikicdn.com/ts/product/f1/31/4d/7f4eec5037978756b691ad1997e6f8fa.jpg
194199552,Nghệ Thuật Thiết Lập Truyền Thông (TBL3),Thích Nhất Hạnh,95000,82100,165.0,Nghệ Thuật Thiết Lập Truyền Thông (TBL3),8,5.0,185.0,Nhà Xuất Bản Thế Giới,https://salt.tikicdn.com/ts/product/87/e0/62/6068400a3351faace31b661eb89f922a.jpg
87959745,Hạnh Phúc Là Con Đường,Hà Vĩnh Thọ,155000,93000,1349.0,Truyện ngắn - Tản văn - Tạp Văn,158,5.0,368.0,Nhà Xuất Bản Thế Giới,https://salt.tikicdn.com/ts/product/06/ed/f7/8d9de8007c05a442588005f1079948c6.jpg
197655112,Bản Đồ Tư Duy Trong Thuyết Trình  (Tái bản 2022),Alphabooks,89000,55500,66.0,Sách kỹ năng làm việc,2,5.0,148.0,Nhà Xuất Bản Dân Trí,https://salt.tikicdn.com/ts/product/3f/e3/9e/62b6b8ebcd67cd841657c67ad92412b5.jpg
152743081,Bàn Tay Ánh Sáng,Barbara Ann Brennan,269000,188000,389.0,Kiến Thức Bách Khoa,50,5.0,624.0,Nhà Xuất Bản Thế Giới,https://salt.tikicdn.com/ts/product/95/27/2f/57db3e1a04439252fc8e4a45ab5dd4d4.jpg
152517438,Dữ Liệu Bạch Kim (Văn Học Trinh Thám),Higashino Keigo,159000,112000,784.0,Truyện trinh thám,149,5.0,460.0,Nhà Xuất Bản Thanh Niên,https://salt.tikicdn.com/ts/product/0e/b7/c4/c9b9969e212eb2ebecce14cc37d5803c.jpg
73553837,Ngọc Sáng Trong Hoa Sen (Tái Bản 2020),Nguyên Phong,128000,84400,566.0,Sách nghệ thuật sống đẹp,103,5.0,368.0,Nhà Xuất Bản Thế Giới,https://salt.tikicdn.com/media/catalog/producttmp/b5/ac/4a/938d265efb596ab0d38992893592619f.jpg
206576729,Phòng Thiết Kế Khai Thiên Lập Địa – Tập 1 [Tặng Bookmark + Sticker],Hebi-zou,36000,36000,31.0,Phòng Thiết Kế Khai Thiên Lập Địa – Tập 1 [Tặng Bookmark + Sticker],4,4.8,144.0,Nhà Xuất Bản Kim Đồng,https://salt.tikicdn.com/ts/product/12/80/34/7469bfe242d9a2e11e2a662ecf7b26ae.jpg
57911668,Kho Báu Bị Nguyền Rủa,Michel Bussi,189000,161000,,Truyện trinh thám,0,0.0,496.0,Nhà Xuất Bản Hội Nhà Văn,https://salt.tikicdn.com/ts/product/bf/01/dd/e52125f3945b634bda6f0de501539652.jpg
13624088,Nghĩ Thiện Để Cuộc Đời Và Công Việc Viên Mãn,Inamori Kazuo,70000,56100,3213.0,Sách tư duy - Kỹ năng sống,206,4.8,196.0,,https://salt.tikicdn.com/ts/product/0d/30/92/e49d2293c601bb8db2164ee14f7a8f3e.jpg
145288026,Chia Rẽ - Tại Sao Chúng Ta Đang Sống Trong Thời Đại Của Những Bức Tường,Tim Marshall,200000,120000,1745.0,Truyện ngắn - Tản văn - Tạp Văn,272,4.8,396.0,Nhà Xuất Bản Dân Trí,https://salt.tikicdn.com/ts/product/15/ce/8e/0d9f11fc37b0de189ba66f4f07359108.jpg
101983078,Ông Nội Vượt Ngục,David Walliams,128000,76800,483.0,Truyện cười,72,4.8,428.0,Nhà Xuất Bản Hội Nhà Văn,https://salt.tikicdn.com/ts/product/38/38/8c/c7467f3ed503b6eada78a60282a2a252.jpg
11368965,Combo Giáo Trình Chuẩn HSK 1 - Bài Học (Kèm 1 MP3) và Giáo Trình Chuẩn HSK 1 - Bài Tập (Kèm 1 MP3) ( Tặng Kèm Viết ),Khương Lệ Bình,356000,284800,2441.0,Sách Học Tiếng Hoa,485,5.0,280.0,Nhà Xuất Bản Tổng hợp TP.HCM,https://salt.tikicdn.com/ts/product/36/1d/51/a0098ab3e0527543fdc4014966a396b3.jpg
167686691,"Sách Tổng Ôn Toán Học 12, Sách Ôn Thi THPT Quốc Gia Moon",Nhiều tác giả,200000,139000,986.0,Sách Luyện Thi Đại Học - Cao Đẳng,287,4.8,358.0,Nhà Xuất Bản Hồng Đức,https://salt.tikicdn.com/ts/product/11/cb/99/eabd5f90765829aee8aa50bede3e03b7.jpg
92859698,Tâm Lý Học Biểu Cảm,Mã Hạo Thiên,98000,63001,6134.0,Sách tư duy - Kỹ năng sống,1332,5.0,252.0,Nhà Xuất Bản Văn Học,https://salt.tikicdn.com/ts/product/0f/b5/c3/0fd8f6c4b9b8070d747465351a02a9b3.jpg
11371241,1Q84 (Tập 1) - Tái Bản,Haruki Murakami,138000,82800,991.0,Tiểu Thuyết,118,4.8,,,https://salt.tikicdn.com/ts/product/5f/ee/f3/6ee420477826d0917b482868dfe67f69.jpg
157317126,50cm Một Cuộc Đời [Boxset 3 Tập],Gin Shirakawa,90000,90000,808.0,Tranh Truyện,299,4.8,,Nhà Xuất Bản Kim Đồng,https://salt.tikicdn.com/ts/product/ae/61/42/93c4aa3fe123648bb455bbfb92749310.jpg
107707575,Kẻ Ái Kỉ Cô Độc - Đi Vào Thế Giới Ẩn Giấu Trong Trái Tim (The Narcissist You Know),Joseph Burgo PhD,135000,88000,230.0,Sách tư duy - Kỹ năng sống,34,5.0,404.0,Nhà Xuất Bản Phụ Nữ Việt Nam,https://salt.tikicdn.com/ts/product/f4/5a/83/458b025629f9f2860f7633f55f70d69c.jpg
193226972,Thế Giới Otomegame Thật Khắc Nghiệt Với Nhân Vật Quần Chúng (Tập 1) - Tái Bản,Mishima Yomu,157000,110001,68.0,Light novel,26,4.8,516.0,Nhà Xuất Bản Thế Giới,https://salt.tikicdn.com/ts/product/43/0e/99/fc59900ec848367d602e565861160172.jpg
160488880,OKR - Từ Chiến Lược Mục Tiêu Đến Kết Quả Then Chốt,Masaru Amono,129000,92000,132.0,"Sách quản trị, lãnh đạo",13,4.8,204.0,Nhà Xuất Bản Công Thương,https://salt.tikicdn.com/ts/product/6c/b5/7b/fd66adaa6a58ea1e796a71eb19a0cddb.jpg
6563565,10 vạn câu hỏi vì sao - trọn bộ 5 tập,Đức Anh,219000,157000,15471.0,Kiến thức - Bách khoa,1674,4.7,203.0,,https://salt.tikicdn.com/ts/product/63/3e/6d/cd60627a92eb68c66c88ad2210296975.jpg
160488838,Axit Và Kiềm Trong Thực Dưỡng (Tái Bản),Herman Aihara,75000,52500,724.0,Axit Và Kiềm Trong Thực Dưỡng (Tái Bản),81,5.0,214.0,Nhà Xuất Bản Thế Giới,https://salt.tikicdn.com/ts/product/5c/45/90/17dd600ff1ba2d4dfb2cb017766a7f32.jpg
52785564,Dịch Hạch (Nobel Văn Chương 1957),Albert Camus,129000,77400,2904.0,Tác phẩm kinh điển,508,4.6,392.0,Nhà Xuất Bản Dân Trí,https://salt.tikicdn.com/ts/product/36/48/39/2ef073f6a40a268deb12ecc35a6b1145.jpg
76012201,Những Ngày Thơ Ấu (Việt Nam Danh Tác),Nguyên Hồng,75000,45000,631.0,Truyện ngắn - Tản văn - Tạp Văn,135,4.8,184.0,Nhà Xuất Bản Hội Nhà Văn,https://salt.tikicdn.com/ts/product/10/46/b1/25a5b8c0299dcf3ab0c6bfe65fca24e3.jpg
984938,Gã Nghiện Giày - Tự Truyện Của Nhà Sáng Lập NIKE,Phil Knight,160000,115000,8535.0,Sách doanh nhân,626,4.8,,,https://salt.tikicdn.com/media/catalog/product/g/a/ganghiengiay.u5430.d20171002.t100231.992728.jpg
190601858,Tạo lập kế hoạch kinh doanh for Dummies,Veechi Curtis,249000,174000,104.0,Bài học kinh doanh,10,5.0,504.0,Nhà Xuất Bản Công Thương,https://salt.tikicdn.com/ts/product/3c/d5/bc/fbea90d52fc7655a3b6763cef475d67e.jpg
200928947,Những Gì Đã Qua Đừng Nghĩ Lại Quá Nhiều,Minh Mẫn - Du Phong,98000,58000,181.0,Truyện ngắn - Tản văn - Tạp Văn,12,4.7,208.0,Nhà Xuất Bản Văn Học,https://salt.tikicdn.com/ts/product/a2/cb/35/1a72e3df4fb6bdc5b76b240aeb80c9c8.jpg
166033489,Hoàng Tử Bé (Tái Bản 2022),Antoine De Saint-Exupéry,35000,30100,1142.0,Truyện kể cho bé,143,5.0,112.0,Nhà Xuất Bản Kim Đồng,https://salt.tikicdn.com/ts/product/2b/fd/60/96a7a7b9b2a7fac4cc1600918c59b8cf.jpg
197588251,Tô Màu Phát Triển Não Bộ Cho Bé 1-5 Tuổi Tập 7,Phạm Ngọc Điệp,16000,9600,43.0,Tô màu - Luyện chữ  ,3,5.0,20.0,Nhà Xuất Bản Dân Trí,https://salt.tikicdn.com/ts/product/ec/15/0c/84a0bba19292c281e2b45f8b18a627f5.jpg
8011021,Tâm Lý Học Thành Công (Tái Bản),Carol S. Dweck,199000,129000,548.0,Sách tư duy - Kỹ năng sống,85,5.0,480.0,Nhà Xuất Bản Lao Động,https://salt.tikicdn.com/ts/product/41/c8/23/86289a16b242a20ca172c0d9b9c7b978.jpg
59362963,Osho Đàn Ông - The Book Of Men,Osho,119000,83300,1315.0,Sách giáo dục,181,4.8,325.0,Nhà Xuất Bản Hà Nội,https://salt.tikicdn.com/ts/product/f8/52/e3/a9775f490ee377b8ce21200eb86219bf.jpg
27971953,Lược Sử Tôn Giáo,Richard Holloway,129000,77400,4438.0,Lược Sử Tôn Giáo,579,4.7,308.0,,https://salt.tikicdn.com/ts/product/5c/69/27/5a19171b7de6d9b6b2c4ecbf9c005f19.jpg
202895290,Chuyện Con Ốc Sên Muốn Biết Tại Sao Nó Chậm Chạp,Neil Gaiman,45000,27000,22.0,Sách tư duy - Kỹ năng sống,0,0.0,83.0,Nhà Xuất Bản Hội Nhà Văn,https://salt.tikicdn.com/ts/product/f1/45/6a/ef4bde8959c84e5e968fed3a8b93c431.jpg
206844673,Những trận chiến thay đổi lịch sử, DK,500000,400000,22.0,Lịch Sử Thế Giới,6,5.0,256.0,Nhà Xuất Bản Dân Trí,https://salt.tikicdn.com/ts/product/7b/96/f6/331f9bbb82e17e3891b085aad27d8867.jpg
194960730,Nỗi buồn chiến tranh,Bảo Ninh,130000,90100,398.0,Tiểu sử - Hồi ký,51,5.0,,NXB Trẻ,https://salt.tikicdn.com/ts/product/5d/9b/ea/cc61ab0dd4ed7f00589fc7c49d7ca1dd.jpg
186229224,Bộ Sách Khởi Nghiệp Kinh Doanh Online - Marketing và Bán Hàng Hiệu Quả Với Thương Mại Điện Tử Tại Việt Nam,,378000,295000,264.0,Sách khởi nghiệp,34,5.0,,Nhà Xuất Bản Đà Nẵng,https://salt.tikicdn.com/ts/product/e7/20/da/337839b1c11bd3d68d789fee1aa783bc.png
94803499,Rừng Sâu Tăm Tối,Ruth Ware,165000,157000,11.0,Tiểu Thuyết,5,4.8,432.0,Nhà Xuất Bản Hội Nhà Văn,https://salt.tikicdn.com/ts/product/ae/8a/c9/60457050a34cad60febda55f02bc0285.jpg
92551275,Sách - Tin Vào Chính Mình - First News,,68000,64600,,Sách tư duy - Kỹ năng sống,0,0.0,160.0,Nhà Xuất Bản Tổng hợp TP.HCM,https://salt.tikicdn.com/ts/product/70/94/34/0f2c4ee946c85cf54d855017c0c2cc5f.jpg
52329765,Biên Niên Ký Chim Vặn Dây Cót (Tái Bản 2020),Haruki Murakami,199000,119400,2303.0,Tiểu Thuyết,533,4.8,720.0,Nhà Xuất Bản Hội Nhà Văn,https://salt.tikicdn.com/ts/product/70/d5/57/86a39f54565770a8a98fba90769633fc.jpg
199241859,Blue Flag - Tập 4,Kaito,45000,45000,251.0,Blue Flag - Tập 4,31,5.0,208.0,Nhà Xuất Bản Kim Đồng,https://salt.tikicdn.com/ts/product/ae/35/53/0e548df175300695facb371d7265620d.jpg
160488843,"Sống Như Một Cái Cây: Không Tham Lam, Không Chiến Đấu Vô Ích, Sống Khôn Ngoan Một Cách Thầm Lặng",Osamu Tanaka,65000,45500,316.0,Sách nghệ thuật sống đẹp,49,5.0,164.0,Nhà Xuất Bản Công Thương,https://salt.tikicdn.com/ts/product/0c/02/22/66c90fce39563c7d36b91c709d466ff0.jpg
205039751,Đúng Lúc Sẽ Hạnh Phúc Đúng Người Sẽ Bình Yên,Hẻoo,92000,72100,20.0,Truyện ngắn - Tản văn - Tạp Văn,1,5.0,232.0,Nhà Xuất Bản Phụ Nữ,https://salt.tikicdn.com/ts/product/4b/30/2a/78e70394cecce3719f7b8b78e4e3799a.jpg
197587864,Những chuyện tình thế kỷ mới,Tàn Tuyết,208000,124800,139.0,Tiểu Thuyết,15,5.0,536.0,Nhà Xuất Bản Phụ Nữ,https://salt.tikicdn.com/ts/product/65/b9/29/4d5f33dea779876dd400eb781f85e39f.jpg
